{
  "task_id": "2026-08-21-ui-navigation-tooltip",
  "agent": "webapp-orchestrator",
  "started_at": "2026-08-21T00:08:54+02:00",
  "ended_at": "2026-08-21T00:45:02+02:00",
  "request_summary": "Coordinare miglioramenti frontend per navigazione tabelle nelle guide, stato attivo mobile, heading h3 e tooltip interattivi.",
  "playbook_bullets_seen": [
    "P-012",
    "P-015"
  ],
  "playbook_bullets_cited": [
    "P-015"
  ],
  "actions": [
    {
      "description": "Classificato il task come frontend e delegato l'intera patch a webapp-frontend, senza modifiche dirette al codice applicativo.",
      "tool": "functions.task"
    },
    {
      "description": "Verificato il diff e coordinato la correzione dell'import runtime Table2, dello stato hash mobile, del layout tooltip e dello scroll delle tabelle.",
      "tool": "functions.read_agent"
    },
    {
      "description": "Eseguiti lint, build, Vitest e test Playwright mirati: lint/build/Vitest verdi e 12/12 test mirati verdi; la suite selezionata finale ha 24/27 verdi.",
      "tool": "functions.powershell"
    },
    {
      "description": "Letti schema e guida ACE e predisposte le trace per orchestratore e frontend.",
      "tool": "functions.view"
    }
  ],
  "outcome": {
    "status": "partial",
    "evaluated_by": "cook-auto",
    "detail": "Le quattro richieste applicative risultano implementate e i test mirati passano. L'esito è auto-valutato subito dopo la risposta, senza aver atteso una reazione successiva dell'utente. La suite E2E completa/selezionata mantiene tre fallimenti preesistenti verificati in HEAD: HomeMethodologyCta non montato, selettori .tag-list assenti e rail desktop già eccedente il viewport."
  },
  "notes": "Il lavoro è rimasto nel worktree senza commit/PR del subagent. Le deleghe hanno rispettato il confine orchestratore/frontend [P-015].",
  "friction": [
    {
      "description": "I primi comandi lint/test sono stati lanciati dalla root invece che da webapp.",
      "recovered": true
    },
    {
      "description": "Le dipendenze locali mancavano; npm ci è stato eseguito dopo il fallimento degli script.",
      "recovered": true
    },
    {
      "description": "Le porte Playwright iniziali erano occupate e sono state sostituite con una porta libera.",
      "recovered": true
    },
    {
      "description": "L'avvio iniziale delle pagine dettaglio ha rilevato Table2 undefined; il frontend agent ha sostituito l'icona e i test sono poi passati.",
      "recovered": true
    }
  ],
  "counted_for_playbook_at": "2026-08-20T22:45:20.048Z"
}
