{
  "task_id": "2026-08-17-chi-siamo-metodologia",
  "agent": "webapp-orchestrator",
  "started_at": "2026-08-17T17:23:12Z",
  "ended_at": "2026-08-17T17:30:00Z",
  "request_summary": "Implementare una sezione 'Chi sono / Metodologia' per rafforzare l'autorità editoriale del sito e far capire il metodo dietro le ricette, senza introdurre backend o route non coerenti con il sito.",
  "playbook_bullets_seen": [
    "P-009",
    "P-014"
  ],
  "playbook_bullets_cited": [
    "P-009",
    "P-014"
  ],
  "actions": [
    {
      "description": "Ho letto il file di istruzioni ACE dell'orchestratore e lo schema delle trace, poi ho classificato il task come frontend-only e delegato il lavoro a webapp-frontend.",
      "tool": "view",
      "timestamp": "2026-08-17T17:23:12Z"
    },
    {
      "description": "Ho supervisato il report del subagent, verificato la coerenza del placement nel footer/supporto e eseguito lint + build finali prima di chiudere il task.",
      "tool": "powershell",
      "timestamp": "2026-08-17T17:30:00Z"
    }
  ],
  "outcome": {
    "status": "success",
    "evaluated_by": "cook-auto",
    "detail": "La delega ha prodotto una modifica coerente e l'app è passata a lint e build. Il contenuto è stato collocato in Supporto come approfondimento secondario, in linea con il requisito di mantenere la home e il ricettario come cuore dell'esperienza."
  },
  "notes": "La sezione è collocata in basso come contenuto di autorità e riferimento, non come primario nav della home. In questa configurazione è stato preferito il footer/supporto per evitare di creare un doppio flusso pagina-home/ricettario.",
  "friction": [
    {
      "description": "L'ambiente del subagent riportava limiti sulla creazione di route dedicate, quindi il contenuto è stato inserito come sezione ancorata nella pagina di supporto in modo coerente con il sito.",
      "recovered": true
    }
  ],
  "counted_for_playbook_at": "2026-08-17T15:29:03.135Z"
}
