{
  "task_id": "2026-08-15-chat-retry-trace-improvements",
  "agent": "webapp-orchestrator",
  "started_at": "2026-08-15T18:35:16.908+02:00",
  "ended_at": "2026-08-15T18:55:37.9522833+02:00",
  "request_summary": "Aggiornare la chat AI ricetta con retry del messaggio fallito, retry di /api/complete alla chiusura, origin dei signals nelle chat-traces, documentazione del flusso, rendering markdown delle risposte e vincoli di lunghezza nel prompt chat; poi validare, tracciare ACE, commit, push e PR.",
  "playbook_bullets_seen": [
    "P-003",
    "P-009",
    "P-010",
    "P-012",
    "P-013",
    "P-014"
  ],
  "playbook_bullets_cited": [
    "P-009",
    "P-013"
  ],
  "actions": [
    {
      "description": "Aggiornata la base da origin/master e creato il branch dedicato feat/chat-retry-trace-improvements prima di iniziare le modifiche.",
      "tool": "powershell"
    },
    {
      "description": "Ispezionati frontend, route API, test e README e scritto un piano per task in plan.md prima dell'implementazione.",
      "tool": "view"
    },
    {
      "description": "Rifattorizzato il pannello chat con stato persistente dei messaggi, retry inline del messaggio fallito, retry di /api/complete alla chiusura e raccolta best-effort del modello assistant.",
      "tool": "apply_patch"
    },
    {
      "description": "Introdotto un renderer markdown condiviso e applicato sia alla pagina ricetta sia ai messaggi assistant della chat.",
      "tool": "apply_patch"
    },
    {
      "description": "Estesi /api/chat e /api/complete con policy di lunghezza, header modello, nuovo schema signals.origin e transcript arricchito dai modelli assistant.",
      "tool": "apply_patch"
    },
    {
      "description": "Aggiornati i JSON storici in webapp/recipes/chat-traces allo schema_version 2 con origin user/model null e documentato il flusso nei README.",
      "tool": "powershell"
    },
    {
      "description": "Eseguiti lint, vitest, next build e Playwright mirati e completi fino a ottenere suite verde.",
      "tool": "powershell"
    }
  ],
  "outcome": {
    "status": "success",
    "evaluated_by": "cook-auto",
    "detail": "Tutti e 6 i task richiesti sono stati implementati; lint, 26 test Vitest, build Next.js e 26 test Playwright sono risultati verdi."
  },
  "notes": "Ho lavorato senza subagenti per mantenere l'ordine richiesto dei task e una sola integrazione coerente sul branch condiviso.",
  "friction": [
    {
      "description": "La worktree non aveva ancora le dipendenze npm installate, quindi i primi comandi lint e Playwright fallivano con 'eslint/playwright not recognized'.",
      "recovered": true
    },
    {
      "description": "Le route API con header Authorization redatti rendevano instabili le patch ampie sul file; ho dovuto ripetere l'editing con patch piu piccole e mirate.",
      "recovered": true
    }
  ],
  "counted_for_playbook_at": "2026-08-15T16:55:58.252Z"
}
