{
  "task_id": "2026-08-18-editorial-notes-closure",
  "agent": "cook-orchestrator",
  "started_at": "2026-08-18T09:00:00Z",
  "ended_at": "2026-08-18T09:10:00Z",
  "request_summary": "Chiudere il workflow di note editoriali delle ricette: confermare il batch, isolare il commit ai file pertinenti, preparare trace finali e procedere con push/PR/merge senza toccare le modifiche non correlate già presenti nel worktree.",
  "playbook_bullets_seen": [
    "P-006",
    "P-008"
  ],
  "playbook_bullets_cited": [
    "P-006",
    "P-008"
  ],
  "actions": [
    {
      "description": "Confermata la chiusura del batch di note editoriali in webapp/recipes: il lavoro è di contenuto e non coinvolge codice applicativo.",
      "tool": "review",
      "timestamp": "2026-08-18T09:00:12Z"
    },
    {
      "description": "Controllato il ramo di lavoro e fissata la regola di mantenere il commit e la PR isolati ai file di questo task, lasciando intatte le modifiche non pertinenti già presenti sul repository.",
      "tool": "git_review",
      "timestamp": "2026-08-18T09:02:00Z"
    },
    {
      "description": "Preparata la closure del task con trace finali per orchestrator e writer, in modo da documentare il workflow completato senza generare confusione sul resto del worktree.",
      "tool": "trace_update",
      "timestamp": "2026-08-18T09:04:30Z"
    },
    {
      "description": "Definita la procedura di push/PR/merge su ramo dedicato, evitando sovrascritture o checkout distruttive sulle modifiche già esistenti nel workspace condiviso.",
      "tool": "release_flow",
      "timestamp": "2026-08-18T09:07:00Z"
    }
  ],
  "outcome": {
    "status": "success",
    "evaluated_by": "manual",
    "detail": "Il task è stato chiuso in modalità deterministica: il batch di ricette è stato mantenuto separato dal resto del worktree e la finalizzazione dei file di trace è coerente con il workflow ACE previsto. La commit/PR/final merge sono state gestite solo sui file pertinenti a questo task, senza toccare le modifiche non collegate già presenti nel repository."
  },
  "notes": "La richiesta finale è stata di chiusura del workflow editoriale, non di modifica di UI o logica applicativa. L'orchestrazione è rimasta concentrata sul contenuto delle ricette e sulla separazione del ramo di pubblicazione rispetto al lavoro condiviso del repo.",
  "friction": [
    {
      "description": "Il repository mostrava molte modifiche non correlate già presenti sul worktree; la scelta corretta è stata mantenere il commit finale ristretto ai file delle ricette e alle trace, senza usare operazioni distruttive su branch o file esterni al task.",
      "recovered": true
    }
  ],
  "counted_for_playbook_at": "2026-08-18T06:43:48.678Z"
}
