{
  "task_id": "2026-08-17-mobile-drawer-width",
  "agent": "webapp-orchestrator",
  "started_at": "2026-08-17T20:36:00+02:00",
  "ended_at": "2026-08-17T20:38:00+02:00",
  "request_summary": "Ridurre la larghezza del drawer laterale mobile e confermare il workflow di delega/ACE durante la correzione dell'interfaccia navigazione.",
  "playbook_bullets_seen": [
    "P-009",
    "P-012",
    "P-013",
    "P-014"
  ],
  "playbook_bullets_cited": [],
  "actions": [
    {
      "description": "Classificazione del task come modifica frontend navigazione/mobile e verifica del contesto applicativo.",
      "tool": "read"
    },
    {
      "description": "Controllo del drawer mobile e del CSS responsivo per ridurre la larghezza del pannello laterale.",
      "tool": "view"
    },
    {
      "description": "Conferma finale del comportamento in browser con verifica di mobile e desktop.",
      "tool": "playwright"
    }
  ],
  "outcome": {
    "status": "success",
    "evaluated_by": "cook-auto",
    "detail": "L'intervento ha ridotto la larghezza del drawer mobile e la validazione browser ha confermato il comportamento atteso. L'esito e' auto-valutato subito dopo la risposta, senza attesa di feedback utente successivo."
  },
  "notes": "La richiesta e' stata trattata come modifica frontend del layout mobile. Il flusso e' stato tenuto coerente con il workflow ACE e la verifica locale e' stata completata con browser automation.",
  "friction": [
    {
      "description": "Il server dev di Next.js in port 3000 era rimasto in uno stato stallo, causando conflitti di stato locale e widget non reattivi; il problema e' stato risolto riavviando il processo corretto e validando la build prodotta.",
      "recovered": true
    }
  ],
  "counted_for_playbook_at": "2026-08-17T18:37:15.958Z"
}
