{
  "task_id": "2026-08-12-chat-loading-throbber",
  "agent": "webapp-orchestrator",
  "started_at": "2026-08-12T00:00:00Z",
  "ended_at": "2026-08-12T00:30:00Z",
  "request_summary": "Aggiungere un throbber di attesa dopo l'invio di un messaggio in chat, attivo fino all'arrivo della risposta del modello, per rendere l'attesa meno snervante.",
  "playbook_bullets_seen": [
    "P-009"
  ],
  "playbook_bullets_cited": [
    "P-009"
  ],
  "actions": [
    {
      "description": "Letto ace-webapp-orchestrator.instructions.md come primo passo prima di procedere",
      "tool": "read_file"
    },
    {
      "description": "Classificato il task come puro frontend (stato UI in chat-panel.tsx, nessun contratto API da cambiare) e delegato a un solo subagente",
      "tool": "runSubagent"
    },
    {
      "description": "Delegato l'implementazione a Webapp-frontend con requisiti su indicatore visivo, accessibilita', copertura Playwright e gestione autonoma di branch/commit/PR",
      "tool": "runSubagent"
    },
    {
      "description": "Validato il diff riportato leggendo submitMessage/appendEvents in chat-panel.tsx per confermare che isAwaitingFirstToken si spegne al primo delta",
      "tool": "read_file"
    }
  ],
  "outcome": {
    "status": "success",
    "evaluated_by": "cook-auto",
    "detail": "Esito auto-valutato subito dopo la risposta del subagente, senza attendere una reazione successiva dell'utente. Il subagente ha riportato lint, build, unit test e Playwright tutti verdi e una PR aperta (#28) su un branch dedicato; la lettura di verifica del diff conferma che il comportamento implementato corrisponde alla richiesta."
  },
  "notes": "Task a scope singolo (solo webapp-frontend), quindi nessuna sequenza backend-poi-frontend da coordinare. Il subagente ha dovuto stabilizzare l'harness Playwright (passaggio a next build && next start) per eliminare flakiness preesistente non legata a questa feature; ho verificato che il commit finale includesse solo i file pertinenti al task, coerente con P-010 del playbook globale anche se qui applicato dal subagente.",
  "friction": [
    {
      "description": "Nessuna frizione operativa diretta per l'orchestratore in questa sessione: la delega a un singolo subagente e' stata lineare, senza ambiguita' residue da chiarire con l'utente.",
      "recovered": true
    }
  ],
  "counted_for_playbook_at": "2026-08-12T19:07:19.151Z"
}
