{
  "task_id": "2026-08-20-piadine-rescale",
  "agent": "webapp-orchestrator",
  "started_at": "2026-08-20T01:20:29+02:00",
  "ended_at": "2026-08-20T01:36:00+02:00",
  "request_summary": "Coordinare correzione ricetta piadine, rescale per numero di piadine, istruzioni, test, ACE, commit, PR e merge.",
  "playbook_bullets_seen": [
    "P-003",
    "P-010",
    "P-012",
    "P-014",
    "P-015"
  ],
  "playbook_bullets_cited": [
    "P-010",
    "P-012",
    "P-015"
  ],
  "actions": [
    {
      "description": "Ha classificato il task come contenuto Markdown + frontend client-side; ha escluso il backend perché non erano coinvolte route o integrazioni server.",
      "tool": "analysis"
    },
    {
      "description": "Ha delegato la ricetta a cook-writer e la UI/istruzioni/test a webapp-frontend, mantenendo separati i perimetri.",
      "tool": "task"
    },
    {
      "description": "Ha verificato diff, riferimenti alla resa base e comportamento applicativo senza edit diretto dei file applicativi.",
      "tool": "view/powershell"
    },
    {
      "description": "Ha eseguito lint, build, test unitario mirato e Playwright mirato su porta isolata.",
      "tool": "powershell"
    },
    {
      "description": "Ha letto schema e guida ACE e scritto le trace separate per tutti gli agenti coinvolti prima dei commit.",
      "tool": "view/apply_patch"
    }
  ],
  "outcome": {
    "status": "success",
    "evaluated_by": "cook-auto",
    "detail": "Esito auto-valutato subito dopo la risposta, senza attendere una reazione successiva dell'utente. La soluzione è implementata e verificata; la suite unit completa conserva un fallimento preesistente non correlato in tag-groups."
  },
  "notes": "Applicati i guardrail di delega [P-015] e di verifica indipendente/contabilità [P-012]. Lo staging futuro deve restare selettivo secondo [P-010]. Non è stata invocata una trace backend perché il backend non era coinvolto.",
  "friction": [
    {
      "description": "I primi comandi npm sono stati lanciati dalla root invece che da webapp.",
      "recovered": true
    },
    {
      "description": "Le dipendenze webapp mancavano e sono state installate prima della validazione.",
      "recovered": true
    },
    {
      "description": "La porta 3000 e una porta di prova erano occupate; Playwright è stato eseguito su una porta casuale isolata.",
      "recovered": true
    },
    {
      "description": "La suite unit completa ha fallito un test preesistente su tag-groups, mentre i test mirati sono verdi.",
      "recovered": true
    }
  ],
  "counted_for_playbook_at": "2026-08-19T23:39:38.739Z"
}
